{
  "$schema": "https://www.schemastore.org/claude-code-marketplace.json",
  "name": "bendrucker",
  "version": "1.0.0",
  "description": "Claude Code plugins for language support, workflows, and integrations",
  "owner": {
    "name": "Ben Drucker",
    "url": "https://github.com/bendrucker"
  },
  "plugins": [
    {
      "name": "go",
      "description": "Go language coding standards, best practices, and testing patterns",
      "source": "./plugins/go"
    },
    {
      "name": "mac",
      "description": "macOS-specific automation, sandbox workarounds, and system integration",
      "source": "./plugins/mac"
    },
    {
      "name": "git",
      "description": "Git workflow and branching best practices",
      "source": "./plugins/git"
    },
    {
      "name": "gitlab",
      "description": "GitLab workflow best practices and glab CLI usage",
      "source": "./plugins/gitlab"
    },
    {
      "name": "linear",
      "description": "Managing Linear issues, projects, and teams",
      "source": "./plugins/linear"
    },
    {
      "name": "things",
      "description": "Interacting with Things 3 task manager for Mac",
      "source": "./plugins/things"
    },
    {
      "name": "issue",
      "description": "Work on issues from GitHub, Linear, or GitLab",
      "source": "./plugins/issue"
    },
    {
      "name": "review",
      "description": "Code review workflows for pull requests and the working diff",
      "source": "./plugins/review"
    },
    {
      "name": "newline",
      "description": "POSIX-compliant trailing newline management",
      "source": "./plugins/newline"
    },
    {
      "name": "writing",
      "description": "Style enforcement and AI trope detection for human-consumable prose",
      "source": "./plugins/writing"
    },
    {
      "name": "github",
      "description": "GitHub workflow, Actions monitoring, and rulesets management",
      "source": "./plugins/github"
    },
    {
      "name": "auto-mode",
      "description": "Enhancements for Claude Code auto mode",
      "source": "./plugins/auto-mode"
    },
    {
      "name": "observability",
      "description": "Query Claude Code session history, tool calls, hooks, and token usage through a DuckDB index over local transcripts",
      "source": "./plugins/observability"
    },
    {
      "name": "plugin",
      "description": "Author Claude Code skills and hooks, whether they live in a plugin, a project's .claude/, or ~/.claude",
      "source": "./plugins/plugin"
    },
    {
      "name": "agents",
      "description": "Run work across multiple Claude Code sessions: agent teams and background handoffs",
      "source": "./plugins/agents"
    },
    {
      "name": "pull-request",
      "description": "Pull request workflows: create, update, babysit CI, and reviewer follow-up",
      "source": "./plugins/pull-request"
    },
    {
      "name": "bun",
      "description": "Bun runtime patterns, bunx, shell scripting, lockfile, and testing",
      "source": "./plugins/bun"
    },
    {
      "name": "research",
      "description": "Research existing solutions when exploring a new problem space",
      "source": "./plugins/research"
    },
    {
      "name": "shortcuts",
      "description": "Creating and running macOS Shortcuts programmatically",
      "source": "./plugins/shortcuts"
    },
    {
      "name": "type-ignore",
      "description": "Detects and eliminates type ignores across your codebase",
      "source": "./plugins/type-ignore"
    },
    {
      "name": "x-callback-url",
      "description": "Call x-callback-url schemes from the CLI and receive responses",
      "source": "./plugins/x-callback-url"
    },
    {
      "name": "ui-design",
      "description": "UI design tools including wireframing with layout validation",
      "source": "./plugins/ui-design"
    },
    {
      "name": "mermaid",
      "description": "Create, validate, and render Mermaid diagrams",
      "source": "./plugins/mermaid"
    },
    {
      "name": "mod-events",
      "description": "Structured event log for mods: `$.modEvents.emit` writes per-session OTel log records as JSONL",
      "source": "./plugins/mod-events"
    },
    {
      "name": "tech-spec",
      "description": "Create and review technical specifications",
      "source": "./plugins/tech-spec"
    },
    {
      "name": "plan",
      "description": "Planning mode guidelines and context injection",
      "source": "./plugins/plan"
    },
    {
      "name": "mail",
      "description": "Apple Mail integration for reading and managing email via JXA",
      "source": "./plugins/mail"
    },
    {
      "name": "opentelemetry",
      "description": "OpenTelemetry instrumentation patterns, semantic conventions, and testing",
      "source": "./plugins/opentelemetry"
    },
    {
      "name": "terraform",
      "description": "Terraform Cloud workspace management, run monitoring, and registry lookups",
      "source": "./plugins/terraform"
    },
    {
      "name": "honeycomb",
      "description": "Honeycomb CLI and MCP server for observability",
      "source": {
        "source": "github",
        "repo": "bendrucker/honeycomb-cli"
      }
    },
    {
      "name": "raycast",
      "description": "Raycast extension development patterns, API, and Store publishing",
      "source": "./plugins/raycast"
    },
    {
      "name": "run-command",
      "description": "Pick a reply's `! <command>` suggestion by click or digit to fill it into the shell prompt",
      "source": "./plugins/run-command"
    },
    {
      "name": "sandbox",
      "description": "Refuse a sandbox bypass whose commands already escape through sandbox.excludedCommands, naming the form that escapes without the flag",
      "source": "./plugins/sandbox"
    },
    {
      "name": "session-limit",
      "description": "Warn the model mid-turn as the 5-hour or 7-day limit nears",
      "source": "./plugins/session-limit"
    },
    {
      "name": "load",
      "description": "Keep Claude-driven browsers and builds from saturating the machine",
      "source": "./plugins/load"
    },
    {
      "name": "zsh",
      "description": "Quote the bash habits that misfire under zsh before the Bash tool runs them, and explain zsh errors after",
      "source": "./plugins/zsh"
    },
    {
      "name": "herdr",
      "description": "Drive the herdr terminal workspace manager: panes, tabs, workspaces, and sibling coding agents",
      "source": "./plugins/herdr"
    },
    {
      "name": "comments",
      "description": "Detect AI slop code comments in a diff and steer clean comment generation",
      "source": "./plugins/comments"
    },
    {
      "name": "meme",
      "description": "Generate memes from images: classic Impact macros, labels, and TV-subtitle captions",
      "source": "./plugins/meme"
    },
    {
      "name": "activitywatch",
      "description": "Query local ActivityWatch usage data: per-app time, window titles, and active vs idle spans",
      "source": "./plugins/activitywatch"
    },
    {
      "name": "atuin",
      "description": "Query local shell history from atuin: recent commands, usage stats, and ad-hoc SQL over the history db",
      "source": "./plugins/atuin"
    },
    {
      "name": "prompting",
      "description": "Writing documents a model executes: prompts, skills, tool descriptions, CLAUDE.md",
      "source": "./plugins/prompting"
    },
    {
      "name": "performance",
      "description": "Profile, benchmark, and hill-climb software performance with noise-aware measurement",
      "source": "./plugins/performance"
    },
    {
      "name": "friction",
      "description": "Count recurring friction across the development setup and surface only small fixes for symptoms that persist",
      "source": "./plugins/friction"
    },
    {
      "name": "evals",
      "description": "Design eval suites, hill-climb against them, and review climbs for overfitting",
      "source": "./plugins/evals"
    }
  ]
}
